{
  "metadata": {
    "framework": "AI Engineering Framework",
    "identifier": "AIEF",
    "description": "Repository-driven, model-agnostic operating system for AI-assisted engineering projects.",
    "authors": ["Chief Systems Engineer (A4)"],
    "license": "MIT AND CC-BY-4.0 - see LICENSE at the repository root, which declares the path boundary. Code MIT; documents, engineering artifacts and generated design data CC-BY-4.0. Ratified S-2026-08-17-01 under owner-delegated licence authority (DECISIONS_S-2026-08-17-01 DEC-11), closing C-4",
    "provenance": {
      "frozen_by": "Chief Systems Engineer (A4)",
      "freeze_document": "AIEF-FRZ-001 Framework Architecture Freeze 1.0.0",
      "amendment_document": "AIEF-AMD-001 Architecture Amendments 1.0.0"
    },
    "reproducible": {
      "required": true,
      "hash_algorithm": "SHA-256",
      "normalisation": {
        "encoding": "UTF-8",
        "line_ending": "LF",
        "trailing_whitespace": "stripped",
        "terminal_newline": "enforced"
      },
      "digest_constructions": {
        "note": "Normative. DC-1 restated unchanged from AIEF-FRZ-001 section 1.7; DC-2 and DC-3 declared by AIEF-AMD-008 AMD-16 and AMD-17; DC-4 and DC-5 declared by AIEF-AMD-010 AMD-27 and AMD-28. Every digest the framework requires, verifies or depends upon is constructed here. A digest that is required and verified but never constructed is the defect class these five close.",
        "per_artifact": {
          "id": "DC-1",
          "algorithm": "SHA-256",
          "authority": "AIEF-FRZ-001 section 1.7 OD-2; project/FROZEN.md",
          "domain": "normalised file content",
          "normalisation": "decode UTF-8 stripping any byte-order mark; convert CRLF and lone CR to LF; strip trailing whitespace from every line; remove trailing blank lines; append exactly one terminal LF; encode UTF-8",
          "empty_content": "a file whose normalised content is empty - no line survives the trailing-blank-line removal - has the empty octet string as its preimage, and its DC-1 digest is therefore e3b0c44298fc1c149afbf4c8996fb92427ae41e4649b934ca495991b7852b855, the SHA-256 of zero octets. The append exactly one terminal LF step applies to surviving content, not to emptiness: appending an LF to nothing would make an empty file and a file holding one blank line produce the same digest, collapsing two distinct states into one. Declared by AIEF-AMD-013 AMD-48. This rule defines the digest of an empty file; it does not licence one - an emitted or registered artifact with no content remains a defect under the zero-dead-file rule of AIEF-FRZ-001 section 1.5, and no covered or registered artifact is empty today",
          "output": "64 lowercase hexadecimal characters",
          "status": "unchanged by AIEF-AMD-008; restated here so all three constructions have one home; the empty_content edge declared by AIEF-AMD-013 AMD-48 resolves an undefined case in the line-wise wording and alters no non-empty digest"
        },
        "frozen_set_aggregate": {
          "id": "DC-2",
          "algorithm": "SHA-256",
          "authority": "AIEF-AMD-008 AMD-16, disposing ECR-Q-001",
          "target_fields": ["project/FROZEN.md section Aggregate", "project/STATE.md frozen_set_hash"],
          "covers": "every entry of the project/FROZEN.md registered-artifact table, as the pair (registered path, DC-1 digest); nothing else - not file contents, not FROZEN.md itself, not registry prose, not the registration history",
          "record": "<path> <SP> <digest> <LF>, where <path> is the repository-relative POSIX path exactly as registered, <SP> is one U+0020, <digest> is 64 lowercase hexadecimal characters and <LF> is one U+000A",
          "record_order": "ascending by the UTF-8 octet sequence of <path>, compared as unsigned octets, shorter prefix first; the order of rows in the registry table is not used and carries no meaning",
          "preimage": "the records concatenated in that order; no header, no trailer, no separator beyond each record terminal LF, no byte-order mark",
          "encoding": "UTF-8",
          "self_exclusion": "the aggregate is not part of its own preimage",
          "output": "64 lowercase hexadecimal characters, recorded in full in both target fields; truncation is prohibited",
          "empty_registry": "e3b0c44298fc1c149afbf4c8996fb92427ae41e4649b934ca495991b7852b855",
          "duplicate_path": "a path registered twice is a registry defect; DC-2 is undefined for it and check V-24 fails",
          "worked_example": {
            "input": [
              ["a/alpha.md", "0000000000000000000000000000000000000000000000000000000000000000"],
              ["b/beta.md", "1111111111111111111111111111111111111111111111111111111111111111"]
            ],
            "digest": "8de12581a7d3aef29454fcdfd696a71e4d5c1a0352f69c7a6b03b167d0f5f1b3"
          },
          "live_value_location": "the live aggregate is recorded in project/FROZEN.md and project/STATE.md, never inside a registered artifact, because a registered artifact printing the aggregate would change it",
          "superseded_value": {
            "value": "42bce7b0de019f854f99387edfc901b054b540f829bfe365e003be96892d5847",
            "status": "SUPERSEDED. Not reproducible by any of thirteen tested constructions. DC-2 is defined going forward and does not recover it. Retained for audit only and never used as a comparison basis."
          }
        },
        "ledger_entry_hash": {
          "id": "DC-3",
          "algorithm": "SHA-256",
          "authority": "AIEF-AMD-008 AMD-17, disposing ECR-Q-002",
          "target_fields": ["project/ledger/SEG-nnnn/L-nnnnnnn entry_hash", "project/ledger/HEAD entry_hash"],
          "covered_fields": ["seq", "timestamp", "session_id", "actor", "action", "artifacts", "prev_hash"],
          "covered_fields_derivation": "schemas[sch-ledger-entry].required_fields with entry_hash omitted, in the declared order; not alphabetical, not file order",
          "self_exclusion": "entry_hash is excluded from its own preimage",
          "undeclared_fields": "excluded from the preimage; a digest that varied with content not declared in the manifest would not be reproducible from the manifest alone. Consequence: any field beyond the declared seven is not protected by the chain",
          "record": "<field-name> <SP> <value> <LF>, where <SP> is one U+0020 and <LF> is one U+000A",
          "value_forms": {
            "seq": "decimal integer; no sign, no leading zeros, no digit separators; the filename L-0000007 is zero-padded, the value is 7",
            "timestamp": "YYYY-MM-DDTHH:MM:SSZ; UTC only, second precision, literal T and Z; no fractional seconds, no numeric offset form",
            "session_id": "as recorded, of the form S-YYYY-MM-DD-nn",
            "actor": "the role token only, per AIEF-AMD-008 AMD-20: a roleId registered in core/agents/INDEX.md, or the reserved token boot or role-unrecorded; the session is carried by session_id and is never duplicated here",
            "action": "the recorded string, single line",
            "artifacts": "repository-relative POSIX paths sorted ascending by UTF-8 octets, joined by one U+002C with no surrounding space; the empty list serialises to the empty string, giving an eleven-octet record - the nine characters of the field name, U+0020, U+000A - whose space is significant and must not be stripped",
            "prev_hash": "64 lowercase hexadecimal characters, or the literal four-character token null"
          },
          "value_constraints": "a value contains no LF, no CR and no leading or trailing U+0020; a violation is a BLOCKING schema error and is rejected, never silently normalised, because silent normalisation would make two different entries hash alike",
          "preimage": "the seven records concatenated in the declared field order; no header, no trailer, no byte-order mark",
          "encoding": "UTF-8",
          "digest_domain": "the canonical preimage above, never the entry file on-disk octets; file layout, key order, comments and whitespace do not affect the digest",
          "chain_rule": "prev_hash is a covered field and is therefore an input to the successor digest; altering entry n changes entry_hash(n), which is prev_hash(n+1), and every digest after it. This is what makes the ledger tamper-evident rather than merely sequential",
          "genesis": {
            "head_at_genesis": "seq 0, entry_hash null, prev_hash null - AIEF-AMD-003 AMD-10, unchanged",
            "first_entry": "L-0000001 carries seq 1 and prev_hash as the literal token null",
            "head_after_first_close": "state active, seq 1, entry_hash equal to DC-3 of L-0000001, prev_hash null"
          },
          "head_binding": "HEAD.entry_hash is always the DC-3 digest of the entry at HEAD.seq; HEAD.prev_hash is always that entry prev_hash; boot step B4 check 1 recomputes DC-3 over the named entry and compares",
          "output": "64 lowercase hexadecimal characters",
          "worked_example": {
            "entry_1": { "seq": 1, "timestamp": "2026-01-01T00:00:00Z", "session_id": "S-2026-01-01-01", "actor": "chief-systems-engineer", "action": "example", "artifacts": ["a/alpha.md", "b/beta.md"], "prev_hash": null },
            "entry_1_digest": "cb8e79720632c4f3bb0050a181ae0bffe2189f629b7fb7bfb1e3d8457d8259e0",
            "entry_2": { "seq": 2, "timestamp": "2026-01-01T00:00:00Z", "session_id": "S-2026-01-01-01", "actor": "chief-systems-engineer", "action": "example-successor", "artifacts": [], "prev_hash": "cb8e79720632c4f3bb0050a181ae0bffe2189f629b7fb7bfb1e3d8457d8259e0" },
            "entry_2_digest": "66e51617abb575133fa7bea5ace6b220f9d8feb4e3911a3d81cd158718f8195b"
          },
          "not_applied": "AIEF-AMD-008 defines DC-3 and does not write L-0000001; HEAD remains at genesis. The genesis to active transition is irreversible and belongs to a session performing a full LAW-09 close"
        },